{
  "wist_version": "1.0.0",
  "domain": "example.com",
  "last_pull_at": "2026-08-02T12:05:00Z",
  "quota_remaining": 998,
  "state": "active",
  "collections": [
    {
      "name": "default",
      "latest": null,
      "accepted": "sha256:1111111111111111111111111111111111111111111111111111111111111111",
      "waiting": [
        {
          "id": "sha256:1111111111111111111111111111111111111111111111111111111111111111",
          "deferrals": [
            "capacity"
          ],
          "held": false
        }
      ]
    }
  ],
  "rejections": [
    {
      "code": "WIST2-E08",
      "at": "2026-08-02T12:05:00Z",
      "id": "sha256:1111111111111111111111111111111111111111111111111111111111111111",
      "collection": "default",
      "condition": "fetch",
      "change_list": "sha256:1111111111111111111111111111111111111111111111111111111111111111",
      "detail": "the change list leading to the fetched Catalog could not be fetched"
    }
  ]
}
